skill_id,is_challenge,question,answer,explantion,option_1,option_2,option_3,option_4,option_5
1,0,"While doing Creativity Visualization you have to see action with change (Colour,Size,Shape,Quantity)",1,,TRUE,FALSE,,,
1,0,While adding action if you use Comedy then it wil be easier to memorize.,1,,TRUE,FALSE,,,
1,0,"While doing Visualization, if we use illogical thinking then it will be easier to memorize.",1,,TRUE,FALSE,,,
1,0,"While doing Visualization, You have to Change (Colour, Shape or Size/Quantity without action.",2,,TRUE,FALSE,,,
1,0,Assocaition is like a Hook.,1,,TRUE,FALSE,,,
